BEGIN;
CREATE EXTENSION tinyint
    SCHEMA public;
CREATE EXTENSION sys_syn;
CREATE SCHEMA user_data
    AUTHORIZATION postgres;
CREATE TABLE user_data.test_table (
        test_table_id integer NOT NULL,
        test_table_updated timestamp with time zone,
        test_table_text text,
        CONSTRAINT test_table_pid PRIMARY KEY (test_table_id, test_table_updated));
INSERT INTO sys_syn.in_groups_def VALUES ('in');
SELECT sys_syn.in_table_create (
                'user_data',
                'test_table',
                'in',
                NULL,
                ARRAY[
                       $COL$("test_table_id","integer",Id,"in_source.test_table_id",,,,)$COL$,
                       $COL$("test_table_updated","timestamp with time zone",Attribute,"in_source.test_table_updated",1,,,)$COL$,
                       $COL$("test_table_text","text",Attribute,"in_source.test_table_text",,,,)$COL$
                ]::sys_syn.create_in_column[],
                'user_data.test_table',
                NULL
        );
 in_table_create 
-----------------
 
(1 row)

INSERT INTO user_data.test_table(
        test_table_id, test_table_updated,             test_table_text)
VALUES  (1,              '2009-01-02 03:04:05-00',       'test_data v1'),
        (1,              '2010-01-02 03:04:05-00',       'test_data v2');
INSERT INTO sys_syn.out_groups_def VALUES ('out');
SELECT sys_syn.out_table_create('user_data', 'test_table', 'out');
 out_table_create 
------------------
 
(1 row)

SELECT user_data.test_table_pull(FALSE);
 test_table_pull 
-----------------
 t
(1 row)

UPDATE sys_syn.trans_id_mod SET trans_id_mod = trans_id_mod + 1;
SELECT user_data.test_table_out_move();
 test_table_out_move 
---------------------
 t
(1 row)

SELECT id, delta_type, queue_state FROM user_data.test_table_out_queue;
 id  | delta_type | queue_state 
-----+------------+-------------
 (1) | Add        | Unclaimed
(1 row)

SELECT user_data.test_table_vacuum();
 test_table_vacuum 
-------------------
 
(1 row)

UPDATE user_data.test_table_out_queue SET queue_state = 'Claimed'::sys_syn.queue_state WHERE (id).test_table_id = 1;
UPDATE user_data.test_table_out_queue SET queue_state = 'Processed'::sys_syn.queue_state WHERE (id).test_table_id = 1;
SELECT user_data.test_table_out_processed();
 test_table_out_processed 
--------------------------
 t
(1 row)

SELECT id, delta_type, queue_state FROM user_data.test_table_out_queue;
 id | delta_type | queue_state 
----+------------+-------------
(0 rows)

SELECT user_data.test_table_vacuum();
 test_table_vacuum 
-------------------
 
(1 row)

DELETE FROM user_data.test_table WHERE test_table_id = 1;
UPDATE sys_syn.trans_id_mod SET trans_id_mod = trans_id_mod + 1;SET LOCAL sys_syn.trans_id_curr TO 2;
SELECT user_data.test_table_pull(FALSE);
 test_table_pull 
-----------------
 f
(1 row)

UPDATE sys_syn.trans_id_mod SET trans_id_mod = trans_id_mod + 1;SET LOCAL sys_syn.trans_id_curr TO 3;
SELECT user_data.test_table_out_move();
 test_table_out_move 
---------------------
 t
(1 row)

SELECT id, delta_type, queue_state FROM user_data.test_table_out_queue;
 id  | delta_type | queue_state 
-----+------------+-------------
 (1) | Delete     | Unclaimed
(1 row)

UPDATE user_data.test_table_out_queue SET queue_state = 'Claimed'::sys_syn.queue_state WHERE (id).test_table_id = 1;
UPDATE user_data.test_table_out_queue SET queue_state = 'Processed'::sys_syn.queue_state WHERE (id).test_table_id = 1;
SELECT user_data.test_table_out_processed();
 test_table_out_processed 
--------------------------
 t
(1 row)

SELECT id, delta_type, queue_state FROM user_data.test_table_out_queue;
 id | delta_type | queue_state 
----+------------+-------------
(0 rows)

SELECT user_data.test_table_vacuum();
 test_table_vacuum 
-------------------
 
(1 row)

ROLLBACK;
